<?xml version="1.1" encoding="UTF-8"?>
<!-- <?xml-stylesheet href="index.css" type="text/css"?> -->

<league xmlns:xsi='http://www.w3.org/2001/XMLSchema-instance' 
		  xmlns="https://nichar.com"
	     xsi:noNamespaceSchemaLocation="index.xsd">
	<detail>
		<name>Primero</name>
		<director>
			<name>José Manuel Rubén</name>
			<nationality>ESP</nationality>
			<contact>
				<phone>+00 16557</phone>
				<email>jm.ruben@gmail.com</email>
			</contact>
		</director>
		<season>1</season>
		<start>2016-01-01</start>
		<end>2016-12-31</end>
	</detail>
	<teams>
		<team id="01">
			<description>
				<name>Sanha</name>
				<short>SNH</short>
				<trainer>
					<name>Gina Carreiras</name>
					<nationality>ESP</nationality>
					<licence>A</licence>
					<contact>
						<phone>+00 58743</phone>
						<email>gina.carreiras@gmail.com</email>
					</contact>
				</trainer>
				<stadium>Estadio de Sanha</stadium>
			</description>
			<players>
				<player position="goalkeeper">
					<name>Alberto Carreiras</name>
					<nationality>PRT</nationality>
					<skill>7</skill>
					<age>27</age>
				</player>
				<player position="defender">
					<name>Uông Bửu Đích</name>
					<nationality>VNM</nationality>
					<skill special="technical">7.5</skill>
					<age>28</age>
				</player>
				<player position="defender" status="captain">
					<name>Francisco Calderón</name>
					<nationality>ESP</nationality>
					<skill>8.5</skill>
					<age>26</age>
				</player>
				<player position="defender">
					<name>Niccolò Azzoni</name>
					<nationality>ITA</nationality>
					<skill>7</skill>
					<age>28</age>
				</player>
				<player position="midfielder">
					<name>Feliciano Oliveira</name>
					<nationality>PRT</nationality>
					<skill>7</skill>
					<age>27</age>
				</player>
				<player position="midfielder">
					<name>Sergio Lascaris</name>
					<nationality>ESP</nationality>
					<skill special="free kicks">6.5</skill>
					<age>31</age>
				</player>
				<player position="midfielder">
					<name>Manolo Manzini</name>
					<nationality>ITA</nationality>
					<skill special="powerful">8</skill>
					<age>24</age>
				</player>
				<player position="midfielder">
					<name>Sebastien Lajoinie</name>
					<nationality>FRA</nationality>
					<skill>7</skill>
					<age>27</age>
				</player>
				<player position="midfielder">
					<name>Ciro Forestan</name>
					<nationality>ITA</nationality>
					<skill special="quick">7.5</skill>
					<age>29</age>
				</player>
				<player position="forward">
					<name>Vittorio Inzaghi</name>
					<nationality>ITA</nationality>
					<skill>8.5</skill>
					<age>26</age>
				</player>
				<player position="forward">
					<name>Juan Antonio Pintos del Valle</name>
					<nationality>ESP</nationality>
					<skill>6</skill>
					<age>35</age>
				</player>
			</players>
		</team>
		<team id="02">
			<description>
				<name>Xavao</name>
				<short>XAV</short>
				<trainer>
					<name>Hugo Odehnal</name>
					<nationality>CZE</nationality>
					<licence>B</licence>
					<contact>
						<phone>+00 56416</phone>
						<email>hugo.carreiras@outlook.com</email>
					</contact>
				</trainer>
				<stadium>Estadio de Sanha</stadium>
			</description>
			<players>
				<player position="goalkeeper">
					<name>Eriks Vārpinš</name>
					<nationality>LVA</nationality>
					<skill>6</skill>
					<age>27</age>
				</player>
				<player position="defender">
					<name>Leo Vápník</name>
					<nationality>CZE</nationality>
					<skill>6</skill>
					<age>32</age>
				</player>
				<player position="defender">
					<name>Milan Trkal</name>
					<nationality>CZE</nationality>
					<skill>6</skill>
					<age>28</age>
				</player>
				<player position="defender">
					<name>Anders Selblad</name>
					<nationality>LTU</nationality>
					<skill>7.5</skill>
					<age>25</age>
				</player>
				<player position="midfielder">
					<name>Erotas Tzolakidis</name>
					<nationality>GRC</nationality>
					<skill>7</skill>
					<age>25</age>
				</player>
				<player position="midfielder">
					<name>Sylvain von Matt</name>
					<nationality>NLD</nationality>
					<skill special="quick">6</skill>
					<age>24</age>
				</player>
				<player position="midfielder">
					<name>Milan Školník</name>
					<nationality>CZE</nationality>
					<skill special="powerful">6.5</skill>
					<age>36</age>
				</player>
				<player position="midfielder">
					<name>Alejandro González</name>
					<nationality>MEX</nationality>
					<skill special="technical">6.5</skill>
					<age>26</age>
				</player>
				<player position="forward">
					<name>Felix Krejcar</name>
					<nationality>CZE</nationality>
					<skill>6</skill>
					<age>32</age>
				</player>
				<player position="forward">
					<name>Heinrich Dörig</name>
					<nationality>DEU</nationality>
					<skill>7</skill>
					<age>36</age>
				</player>
				<player position="forward" status="captain">
					<name>Jean-Jacques Schneidewind</name>
					<nationality>CHE</nationality>
					<skill special="free kicks">6.5</skill>
					<age>34</age>
				</player>
			</players>
		</team>
		<team id="03">
			<description>
				<name>Quernera</name>
				<short>QUE</short>
				<trainer>
					<name>Manuelo Pantano</name>
					<nationality>ESP</nationality>
					<licence>A</licence>
					<contact>
						<phone>+00 56874</phone>
						<email>mpantano@outlook.com</email>
					</contact>
				</trainer>
				<stadium>Mejor Arena</stadium>
			</description>
			<players>
				<player position="goalkeeper">
					<name>Raneiro Gramatica</name>
					<nationality>ITA</nationality>
					<skill>6</skill>
					<age>22</age>
				</player>
				<player position="defender">
					<name>Michael di Bartolo</name>
					<nationality>ITA</nationality>
					<skill special="powerful">6</skill>
					<age>30</age>
				</player>
				<player position="defender">
					<name>Marcílio Teixeira</name>
					<nationality>PRT</nationality>
					<skill>6</skill>
					<age>27</age>
				</player>
				<player position="defender">
					<name>Ettore Bartoli</name>
					<nationality>ITA</nationality>
					<skill special="free kicks">7</skill>
					<age>29</age>
				</player>
				<player position="defender">
					<name>Odilson Paiva</name>
					<nationality>BRA</nationality>
					<skill special="head">5</skill>
					<age>30</age>
				</player>
				<player position="midfielder">
					<name>Giulio Scala</name>
					<nationality>DEU</nationality>
					<skill>8</skill>
					<age>28</age>
				</player>
				<player position="midfielder">
					<name>Luigino Isoardi</name>
					<nationality>ITA</nationality>
					<skill>7</skill>
					<age>32</age>
				</player>
				<player position="midfielder">
					<name>Sandalio Roa</name>
					<nationality>ESP</nationality>
					<skill special="quick">8</skill>
					<age>30</age>
				</player>
				<player position="midfielder">
					<name>Cristian Graziozo</name>
					<nationality>ITA</nationality>
					<skill>6</skill>
					<age>30</age>
				</player>
				<player position="forward" status="captain">
					<name>Ricardo Delgado</name>
					<nationality>PER</nationality>
					<skill special="technical">7</skill>
					<age>33</age>
				</player>
				<player position="forward">
					<name>Antauro Moyano</name>
					<nationality>COL</nationality>
					<skill>8.5</skill>
					<age>29</age>
				</player>
			</players>
		</team>
		<team id="04">
			<description>
				<name>Presto Pallares</name>
				<short>PRE</short>
				<trainer>
					<name>Alexandros Mousicos</name>
					<nationality>GRC</nationality>
					<licence>A</licence>
					<contact>
						<phone>+00 64158</phone>
						<email>amusica@gmail.com</email>
					</contact>
				</trainer>
				<stadium>Presto Arena</stadium>
			</description>
			<players>
				<player position="goalkeeper">
					<name>Yorgios Kalogeridis</name>
					<nationality>GRC</nationality>
					<skill>6.5</skill>
					<age>27</age>
				</player>
				<player position="defender">
					<name>Dalimil Polaković</name>
					<nationality>HRV</nationality>
					<skill special="quick">5.5</skill>
					<age>26</age>
				</player>
				<player position="defender">
					<name>Viliam Wiesner</name>
					<nationality>POL</nationality>
					<skill>5</skill>
					<age>27</age>
				</player>
				<player position="defender">
					<name>Boris van Kuppeveld</name>
					<nationality>NLD</nationality>
					<skill>6</skill>
					<age>29</age>
				</player>
				<player position="defender">
					<name>Dietmar Hüttlinger</name>
					<nationality>DEU</nationality>
					<skill special="head">5.5</skill>
					<age>30</age>
				</player>
				<player position="midfielder">
					<name>Samuel Sanchéz</name>
					<nationality>ESP</nationality>
					<skill>7</skill>
					<age>27</age>
				</player>
				<player position="midfielder">
					<name>Witek Mystek</name>
					<nationality>POL</nationality>
					<skill>5</skill>
					<age>31</age>
				</player>
				<player position="midfielder">
					<name>Marvin Warren</name>
					<nationality>USA</nationality>
					<skill>6</skill>
					<age>32</age>
				</player>
				<player position="midfielder" status="captain">
					<name>Marco Macchini</name>
					<nationality>ITA</nationality>
					<skill special="free kicks">7</skill>
					<age>27</age>
				</player>
				<player position="forward">
					<name>Massimo Fucso</name>
					<nationality>ITA</nationality>
					<skill special="technical">7.5</skill>
					<age>29</age>
				</player>
				<player position="forward">
					<name>Garry English</name>
					<nationality>GBT</nationality>
					<skill special="quick">7</skill>
					<age>28</age>
				</player>
			</players>
		</team>
		<team id="05">
			<description>
				<name>Espartinas</name>
				<short>ESP</short>
				<trainer>
					<name>Francisco Costales</name>
					<nationality>PRT</nationality>
					<licence>B</licence>
					<contact>
						<phone>+00 15645</phone>
						<email>costales-frank@gmail.com</email>
					</contact>
				</trainer>
				<stadium>Estadio de Espartinas</stadium>